{"SchemaVersion":1,"ArtifactKind":"canonical-journal-manifest","Header":{"SchemaVersion":1,"ArtifactKind":"canonical-journal-header","TransactionId":"11111111-1111-4111-8111-111111111111","CanonicalOperationKind":"normalize","OriginalDocumentHash":"1111111111111111111111111111111111111111111111111111111111111111","OriginalPlanHash":"2222222222222222222222222222222222222222222222222222222222222222","RepoId":"3333333333333333333333333333333333333333333333333333333333333333","GitCommonDirHash":"4444444444444444444444444444444444444444444444444444444444444444","WorktreeId":"5555555555555555555555555555555555555555555555555555555555555555","TransactionNamespace":"C:\\fixture\\journal","RecoveryTransactionRoot":"C:\\fixture\\recovery","ExpectedPostconditionsHash":"6666666666666666666666666666666666666666666666666666666666666666","Targets":[]},"Records":[{"SchemaVersion":1,"ArtifactKind":"canonical-journal-record","TransactionId":"11111111-1111-4111-8111-111111111111","Sequence":1,"PreviousHash":"95336e4e5b5595557619e473fac0601c726f51a83038a2473cd4b826cc792eb5","Phase":"COMPLETE","Data":{"ResultHash":"77e220350a5d1937cd8b513b7bf528ee7b033f361f56952d8a0f4d2570cfd91a","OriginalDocumentHash":"1111111111111111111111111111111111111111111111111111111111111111","Outcome":"abandoned","ClosingKind":"original","ClosingDocumentHash":"1111111111111111111111111111111111111111111111111111111111111111"}}],"Results":[{"SchemaVersion":1,"ArtifactKind":"canonical-transaction-result","ResultScope":"transaction","Result":"PASS","TransactionId":"11111111-1111-4111-8111-111111111111","CanonicalOperationKind":"normalize","OriginalDocumentHash":"1111111111111111111111111111111111111111111111111111111111111111","ResultBaseHeadHash":"95336e4e5b5595557619e473fac0601c726f51a83038a2473cd4b826cc792eb5","Outcome":"abandoned","ArtifactStates":[{"Name":"targets","Status":"MISSING"}]}]}
